[
  {
    "id": "synthetic_fraud",
    "status": "active",
    "access": "generated",
    "brief": "benchmarks/datasets/synthetic_fraud/brief.md",
    "task_type": "binary",
    "target_variable": "is_fraud",
    "positive_label": 1,
    "primary_metric": "pr_auc",
    "secondary_metrics": ["roc_auc", "precision_at_top_1pct", "recall_at_top_1pct"],
    "dataset_format": "csv",
    "generator": {"script": "scripts/generate_synthetic_fraud.py",
                  "args": ["--rows", "40000", "--fraud-rate", "0.01", "--seed", "7"],
                  "output": "synthetic_fraud/transactions.csv"},
    "source": "scripts/generate_synthetic_fraud.py (stdlib, deterministic)",
    "license": "internal, synthetic",
    "notes": "Traps: chargeback_flag leakage, constant currency, 4,000-level merchant_id, duplicates, drift. The answer key is written next to the data dir; never give it to the agent.",
    "split": {"split_strategy": "temporal", "time_column": "event_time", "split_ratio": 0.2},
    "entity_id_column": "customer_id",
    "id_columns": ["transaction_id"],
    "drop_columns": ["transaction_id", "customer_id", "event_time", "currency", "merchant_id", "chargeback_flag"],
    "business_context": "Rank card transactions so analysts review the riskiest 1% first.",
    "features": "benchmarks/datasets/synthetic_fraud/features.json",
    "sizing": "benchmarks/datasets/synthetic_fraud/sizing.json",
    "smoke_rows": 20000,
    "performance": {"expected_band": {"min": 0.25, "max": 0.85}}
  },
  {
    "id": "telco_churn",
    "status": "active",
    "access": "public_download",
    "brief": "benchmarks/datasets/telco_churn/brief.md",
    "task_type": "binary",
    "target_variable": "Churn",
    "positive_label": "Yes",
    "primary_metric": "roc_auc",
    "secondary_metrics": ["pr_auc", "log_loss"],
    "dataset_format": "csv",
    "download_url": "https://raw.githubusercontent.com/IBM/telco-customer-churn-on-icp4d/master/data/Telco-Customer-Churn.csv",
    "source": "IBM sample data (Telco customer churn)",
    "license": "Apache-2.0 (IBM sample repository)",
    "notes": "TotalCharges is numeric stored as text, with blanks for brand-new customers: the profile must call it numeric_as_text (not an id) and split() coerces it.",
    "split": {"split_strategy": "random_stratified", "split_ratio": 0.2},
    "entity_id_column": null,
    "id_columns": ["customerID"],
    "drop_columns": ["customerID"],
    "business_context": "Score customers by churn risk for a retention campaign.",
    "features": "benchmarks/datasets/telco_churn/features.json",
    "sizing": "benchmarks/datasets/telco_churn/sizing.json",
    "smoke_rows": 3000,
    "performance": {"automl_best": {"metric": "roc_auc", "value": 0.85, "source": "commonly reported baseline"},
                    "expected_band": {"min": 0.70, "max": 0.92}}
  },
  {
    "id": "give_me_some_credit",
    "status": "draft",
    "access": "manual",
    "brief": "benchmarks/datasets/give_me_some_credit/brief.md",
    "task_type": "binary",
    "target_variable": "SeriousDlqin2yrs",
    "positive_label": 1,
    "primary_metric": "roc_auc",
    "secondary_metrics": ["pr_auc"],
    "dataset_format": "csv",
    "download_url": null,
    "source": "Kaggle competition 'GiveMeSomeCredit' (requires a Kaggle account and accepting the rules)",
    "notes": "Place cs-training.csv in data/benchmarks/give_me_some_credit/. Exercises the credit_risk domain overlay.",
    "split": {"split_strategy": "random_stratified", "split_ratio": 0.2},
    "entity_id_column": null,
    "id_columns": ["Unnamed: 0"],
    "drop_columns": ["Unnamed: 0"],
    "business_context": "Predict serious delinquency within two years for credit decisioning.",
    "smoke_rows": 5000,
    "performance": {"expected_band": {"min": 0.8, "max": 0.9}}
  }
]
